{
  "ts": "2026-10-15T10:00:00Z",
  "sys_id": "nel-mgenre-multilingual",
  "nes": [
    {
      "type": "pers",
      "surface": "Albert Einstein",
      "lOffset": 0,
      "rOffset": 15,
      "scope": "body",
      "wkd_id": "Q937",
      "wkpedia_pagename": "Albert Einstein",
      "wkpedia_url": "https://de.wikipedia.org/wiki/Albert Einstein",
      "confidence_ner": 0.9871,
      "confidence_nel": 0.9802,
      "confidence_nel_normalized": 0.9802,
      "confidence_margin": 3.1427,
      "entity_confidence": 0.9952,
      "type_confidence": 0.9918,
      "function": null,
      "name": null,
      "title": null,
      "wkd_pred": "Albert Einstein >> de"
    },
    {
      "type": "loc",
      "surface": "Berlin",
      "lOffset": 25,
      "rOffset": 31,
      "scope": "body",
      "wkd_id": "Q64",
      "wkpedia_pagename": "Berlin",
      "wkpedia_url": "https://de.wikipedia.org/wiki/Berlin",
      "confidence_ner": 0.9934,
      "confidence_nel": 0.9613,
      "confidence_nel_normalized": 0.9613,
      "confidence_margin": 2.4719,
      "entity_confidence": 0.9978,
      "type_confidence": 0.9956,
      "function": null,
      "name": null,
      "title": null,
      "wkd_pred": "Berlin >> de"
    }
  ],
  "NEL seconds": 0.7015,
  "NER seconds": 0.0412
}
