{
  "ts": "2026-10-15T10:00:00Z",
  "sys_id": "nel-mgenre-multilingual",
  "nes": {
    "type": "",
    "surface": "Berlin",
    "lOffset": 0,
    "rOffset": 6,
    "scope": "body",
    "wkd_id": "Q64",
    "wkdata_qid": "Q64",
    "wkpedia_lg": "de",
    "wkpedia_pagename": "Berlin",
    "wkpedia_url": "https://de.wikipedia.org/wiki/Berlin",
    "label_fr": "Berlin",
    "label_en": "Berlin",
    "label_de": "Berlin",
    "label_other": null,
    "label_other_lg": null,
    "confidence_ner": null,
    "confidence_nel": 0.9487,
    "confidence_nel_normalized": 0.9487,
    "confidence_margin": 2.0518,
    "confidence_ner_entity": null,
    "confidence_ner_type": null,
    "entity_confidence": null,
    "type_confidence": null,
    "type_ner_original": null,
    "nel_unlink": null,
    "function": null,
    "name": null,
    "title": null,
    "wkd_pred": "Berlin >> de"
  },
  "NEL seconds": 0.4102,
  "NER seconds": 0.0
}
