{
  "ts": "2026-10-15T10:00:00Z",
  "sys_id": "nel-mgenre-multilingual",
  "nes": [
    {
      "type": "pers",
      "surface": "Hans Müller",
      "lOffset": 0,
      "rOffset": 11,
      "scope": "body",
      "wkd_id": null,
      "wkpedia_pagename": "Hans Müller",
      "wkpedia_url": "https://de.wikipedia.org/wiki/Hans Müller",
      "confidence_ner": 0.9712,
      "confidence_nel": 0.4127,
      "confidence_nel_normalized": 0.4127,
      "confidence_margin": 0.0815,
      "entity_confidence": null,
      "type_confidence": null,
      "function": null,
      "name": null,
      "title": null,
      "wkd_pred": "Hans Müller >> de"
    },
    {
      "type": "loc",
      "surface": "Berlin",
      "lOffset": 21,
      "rOffset": 27,
      "scope": "body",
      "wkd_id": "Q64",
      "wkpedia_pagename": "Berlin",
      "wkpedia_url": "https://de.wikipedia.org/wiki/Berlin",
      "confidence_ner": 0.9934,
      "confidence_nel": 0.9521,
      "confidence_nel_normalized": 0.9521,
      "confidence_margin": 2.3104,
      "entity_confidence": null,
      "type_confidence": null,
      "function": null,
      "name": null,
      "title": null,
      "wkd_pred": "Berlin >> de"
    }
  ],
  "NEL seconds": 0.6231,
  "NER seconds": 0.0398
}
